{
  "$schema": "../../schemas/farm_to_table/substitutions.catalog.schema.json",
  "catalogId": "farm_to_table.substitutions",
  "version": "1.0.0",
  "generatedAt": "2026-01-10T02:21:36Z",
  "notes": [
    "Deterministic substitution rules for SSA Farm-to-Table planning.",
    "Rules operate on component IDs, substitution groups, tags, and categories defined in components.catalog.json.",
    "Cuisine and diet/allergen constraints can be used as gates for rule eligibility.",
    "This catalog is designed to be applied in priority order; first match wins unless merge is enabled by the caller."
  ],
  "enums": {
    "matchMode": ["any", "all"],
    "priority": ["critical", "high", "medium", "low"],
    "applyMode": ["replace", "add", "remove", "prefer", "avoid", "suggest"],
    "reasonCodes": [
      "out_of_stock",
      "seasonal_unavailable",
      "allergen_avoidance",
      "diet_preference",
      "cost_saving",
      "time_saving",
      "technique_fit",
      "cuisine_alignment",
      "preservation_fit",
      "storehouse_first",
      "garden_first",
      "animal_first"
    ],
    "dietTags": [
      "omnivore",
      "pescatarian",
      "vegetarian",
      "vegan",
      "gluten_free",
      "dairy_free",
      "egg_free",
      "low_carb",
      "low_sodium"
    ],
    "allergens": [
      "gluten",
      "dairy",
      "egg",
      "soy",
      "fish",
      "shellfish",
      "peanut",
      "tree_nut",
      "sesame"
    ]
  },
  "indexes": {
    "byCuisine": true,
    "byReasonCode": true,
    "byTargetGroup": true,
    "byAllergen": true,
    "byDiet": true
  },
  "groups": [
    {
      "id": "group.protein.poultry",
      "label": "Poultry proteins",
      "description": "Chicken and similar poultry cuts.",
      "match": {
        "substitutionGroupsAny": ["protein.poultry"],
        "tagsAny": ["poultry"],
        "categoryIds": ["proteins.meat"]
      }
    },
    {
      "id": "group.protein.red_meat",
      "label": "Red meat proteins",
      "description": "Beef and lamb cuts.",
      "match": {
        "substitutionGroupsAny": ["protein.red_meat"],
        "tagsAny": ["beef", "lamb"],
        "categoryIds": ["proteins.meat"]
      }
    },
    {
      "id": "group.protein.eggs",
      "label": "Eggs",
      "description": "Eggs as a protein source.",
      "match": {
        "substitutionGroupsAny": ["protein.eggs"],
        "tagsAny": ["eggs"],
        "categoryIds": ["proteins.eggs"]
      }
    },
    {
      "id": "group.legume.dry",
      "label": "Dry legumes",
      "description": "Dry beans and lentils.",
      "match": {
        "substitutionGroupsAny": ["legume.dry_beans", "legume.lentils"],
        "tagsAny": ["beans", "lentils", "legume"],
        "categoryIds": ["staples.legumes"]
      }
    },
    {
      "id": "group.starch.rice",
      "label": "Rice",
      "description": "White/brown rice staples.",
      "match": {
        "substitutionGroupsAny": ["grain.rice_white", "grain.rice_brown"],
        "tagsAny": ["rice"],
        "categoryIds": ["staples.grains"]
      }
    },
    {
      "id": "group.starch.cornmeal",
      "label": "Cornmeal",
      "description": "Cornmeal for cornbread/grits.",
      "match": {
        "substitutionGroupsAny": ["grain.cornmeal"],
        "tagsAny": ["corn", "cornbread", "grits"],
        "categoryIds": ["staples.grains"]
      }
    },
    {
      "id": "group.starch.potato",
      "label": "Potato",
      "description": "Potatoes as starch.",
      "match": {
        "substitutionGroupsAny": ["starch.potato"],
        "tagsAny": ["root", "starch"],
        "categoryIds": ["staples.grains"]
      }
    },
    {
      "id": "group.baking.flour",
      "label": "Flour (wheat/whole wheat)",
      "description": "Wheat flour and wheat berries used for bread/flatbreads.",
      "match": {
        "substitutionGroupsAny": ["grain.flour", "grain.wheat_berries"],
        "tagsAny": ["flour", "grain", "bread", "milling"],
        "categoryIds": ["staples.grains"]
      }
    },
    {
      "id": "group.veg.cabbage",
      "label": "Cabbage",
      "description": "Cabbage/crucifer veg used for slaw, ferment, sides.",
      "match": {
        "substitutionGroupsAny": ["veg.cabbage"],
        "tagsAny": ["crucifer", "slaw", "ferment"],
        "categoryIds": ["produce.vegetables"]
      }
    },
    {
      "id": "group.veg.tomato",
      "label": "Tomato",
      "description": "Tomato base veg.",
      "match": {
        "substitutionGroupsAny": ["veg.tomato"],
        "tagsAny": ["tomato", "sauce", "nightshade"],
        "categoryIds": ["produce.vegetables"]
      }
    },
    {
      "id": "group.veg.aromatics",
      "label": "Aromatics",
      "description": "Onion and garlic.",
      "match": {
        "substitutionGroupsAny": ["veg.onion", "veg.garlic"],
        "tagsAny": ["aromatic", "allium"],
        "categoryIds": ["produce.vegetables"]
      }
    },
    {
      "id": "group.pantry.vinegar",
      "label": "Vinegar / acidifier",
      "description": "Pickling vinegar / acids.",
      "match": {
        "substitutionGroupsAny": [
          "pantry.vinegar",
          "preserve_input.vinegar",
          "preserve_input.acidifier"
        ],
        "tagsAny": ["vinegar", "pickling"],
        "categoryIds": ["pantry.condiments", "preservation.inputs"]
      }
    },
    {
      "id": "group.pantry.tomato_concentrate",
      "label": "Tomato concentrate",
      "description": "Tomato paste and concentrates.",
      "match": {
        "substitutionGroupsAny": ["pantry.tomato_concentrate"],
        "tagsAny": ["tomato", "sauce"],
        "categoryIds": ["pantry.condiments"]
      }
    },
    {
      "id": "group.preserve.inputs.salt",
      "label": "Preservation salt",
      "description": "Salt used for preservation and seasoning.",
      "match": {
        "substitutionGroupsAny": ["preserve_input.salt"],
        "tagsAny": ["salt", "preservation"],
        "categoryIds": ["preservation.inputs"]
      }
    }
  ],
  "rules": [
    {
      "id": "rule.protein_missing_shift_to_legumes_or_eggs",
      "label": "Protein missing → shift to legumes/eggs",
      "description": "If a meat protein is missing/out-of-stock, prefer legumes or eggs; otherwise reduce protein portion and increase veg.",
      "priority": "high",
      "when": {
        "targetRole": "protein",
        "missingGroupAny": ["group.protein.poultry", "group.protein.red_meat"],
        "matchMode": "any"
      },
      "constraints": {
        "cuisinesAny": [],
        "cuisinesNot": [],
        "dietsAny": [],
        "dietsNot": [],
        "allergensAny": [],
        "allergensNot": []
      },
      "then": {
        "applyMode": "prefer",
        "preferGroups": ["group.legume.dry", "group.protein.eggs"],
        "fallbackStrategies": [
          "reduce_target_ratio",
          "increase_group:group.veg.cabbage",
          "increase_group:group.veg.tomato"
        ]
      },
      "reasonCodes": ["out_of_stock", "storehouse_first", "time_saving"],
      "notes": ""
    },
    {
      "id": "rule.starch_missing_swap_rice_potato_cornmeal",
      "label": "Starch missing → swap rice/potato/cornmeal",
      "description": "If preferred starch group is unavailable, swap to another starch group.",
      "priority": "high",
      "when": {
        "targetRole": "starch",
        "missingGroupAny": [
          "group.starch.rice",
          "group.starch.potato",
          "group.starch.cornmeal"
        ],
        "matchMode": "any"
      },
      "constraints": {
        "cuisinesAny": [],
        "cuisinesNot": [],
        "dietsAny": [],
        "dietsNot": [],
        "allergensAny": [],
        "allergensNot": []
      },
      "then": {
        "applyMode": "prefer",
        "preferGroups": [
          "group.starch.rice",
          "group.starch.potato",
          "group.starch.cornmeal"
        ],
        "avoidGroups": [],
        "fallbackStrategies": ["use_bread_from_group:group.baking.flour"]
      },
      "reasonCodes": ["out_of_stock", "storehouse_first"],
      "notes": ""
    },
    {
      "id": "rule.veg_missing_use_preserved_or_fermented",
      "label": "Vegetable missing → use preserved or fermented",
      "description": "If fresh vegetables are low, use frozen/canned/fermented equivalents via preservation tags/groups.",
      "priority": "medium",
      "when": {
        "targetRole": "vegetable",
        "missingGroupAny": ["group.veg.cabbage", "group.veg.tomato"],
        "matchMode": "any"
      },
      "constraints": {
        "cuisinesAny": [],
        "cuisinesNot": [],
        "dietsAny": [],
        "dietsNot": [],
        "allergensAny": [],
        "allergensNot": []
      },
      "then": {
        "applyMode": "suggest",
        "suggestions": [
          {
            "strategy": "use_preserved_variant",
            "methodsPrefer": [
              "preserve.freeze",
              "preserve.culture_ferment",
              "preserve.dehydrate",
              "preserve.pressure_can"
            ]
          },
          {
            "strategy": "use_slaw_or_ferment",
            "group": "group.veg.cabbage"
          }
        ]
      },
      "reasonCodes": ["out_of_stock", "preservation_fit"],
      "notes": ""
    },
    {
      "id": "rule.gluten_free_swap_flour_to_rice_or_potato",
      "label": "Gluten-free: avoid wheat flour → rice/potato/cornmeal",
      "description": "If gluten-free diet is active, avoid wheat flour and shift starch choices to rice, potato, or cornmeal.",
      "priority": "critical",
      "when": {
        "matchAny": [
          {
            "role": "starch",
            "group": "group.baking.flour"
          },
          {
            "role": "bread",
            "group": "group.baking.flour"
          }
        ]
      },
      "constraints": {
        "cuisinesAny": [],
        "cuisinesNot": [],
        "dietsAny": ["gluten_free"],
        "dietsNot": [],
        "allergensAny": [],